{"canonical_profile":"notrios-canonical-json-v1","capture_window_end":"2026-08-26T00:20:27Z","capture_window_start":"2026-08-26T00:20:27Z","checkpoint_id":"g17b-backfill-20260825-0001","contains_retroactive_artifacts":true,"entry_count":162,"first_entry_sha256":"f4360f8b5c07600b1c9a859ce33d4a093b88d9885b1bf995cacebac07143d125","intended_volume_ids":["NTR-EV-0001"],"last_entry_sha256":"726a9a0f4c516aacbea992de7bfd9b5c31872cef26ac1e426abb4119cb5bf978","manifest_sha256":"683c10aaf2ee114306c799d431d3f33e202d77356d47ee0e237f56a5ab505bac","manifest_size_bytes":170477,"predecessor_checkpoint_sha256":null,"schema":"notrios.evidence.content-checkpoint.v1","seal_window_end":"2026-08-26T00:20:27Z","seal_window_start":"2026-08-26T00:20:27Z","source_artifact_count":81,"verifier_version":"notrios-evidence-verifier-v1"}
